{
  "$schema": "../schemas/next-public-surface.schema.json",
  "protocol": "nextjshx.next-public-surface",
  "version": 1,
  "generatedBy": {
    "script": "scripts/bindings/next-surface.mjs",
    "typescriptVersion": "6.0.2"
  },
  "sources": {
    "allowlist": "config/next-public-entrypoints.json",
    "fixtures": "tests/next-surface/fixtures.json",
    "packages": {
      "next": {
        "name": "next",
        "version": "16.2.12"
      },
      "typescript": {
        "importName": "typescript",
        "name": "@typescript/typescript6",
        "version": "6.0.2"
      }
    }
  },
  "publicEntrypoints": [
    {
      "module": "globalThis",
      "source": {
        "kind": "global",
        "library": "lib.dom.d.ts"
      },
      "priority": "P0",
      "fixture": "tests/next-surface/fixtures.json#p0-web-contracts",
      "selectionRationale": "Project the native Web Request and Response contracts through safe Haxe views so Route Handlers retain platform compatibility while JSON decoding uses explicit unknown instead of Haxe 4.3.7 Dynamic.",
      "entrypointDeclaration": {
        "package": "@typescript/typescript6",
        "path": "lib/lib.dom.d.ts"
      },
      "exports": [
        {
          "name": "Request",
          "kind": "type",
          "stability": "stable",
          "signatureHash": "sha256:9a6d3e7cfa0dc7e2b6bdb8856ed88375ae5f1b925c96d38ff8a2be5a4cb40895",
          "haxeTypePath": "nextjs.raw.server.WebRequest",
          "exposure": "raw-only",
          "declarations": [
            {
              "package": "@typescript/typescript6",
              "path": "lib/lib.dom.d.ts",
              "syntaxKind": "InterfaceDeclaration",
              "declaredName": "Request",
              "declarationHash": "sha256:061071c3d508f19893ab9fd7b1c714ca831aebfa41d11346aa15505f77dca0b1",
              "internal": false
            },
            {
              "package": "@typescript/typescript6",
              "path": "lib/lib.dom.d.ts",
              "syntaxKind": "VariableDeclaration",
              "declaredName": "Request",
              "declarationHash": "sha256:89276c973442422345a154d8bc95977a68676f9227cb65a87c1409ed1a194382",
              "internal": false
            }
          ]
        },
        {
          "name": "Response",
          "kind": "type",
          "stability": "stable",
          "signatureHash": "sha256:b032b8c503cb18ece8277fee78c79f679c2db056db976cb43ede64aecb318d12",
          "haxeTypePath": "nextjs.raw.server.WebResponse",
          "exposure": "raw-only",
          "declarations": [
            {
              "package": "@typescript/typescript6",
              "path": "lib/lib.dom.d.ts",
              "syntaxKind": "InterfaceDeclaration",
              "declaredName": "Response",
              "declarationHash": "sha256:d0845799f16b238fb2ff6580c92a31de35db43b76428da3a1e58b8fa5818d065",
              "internal": false
            },
            {
              "package": "@typescript/typescript6",
              "path": "lib/lib.dom.d.ts",
              "syntaxKind": "VariableDeclaration",
              "declaredName": "Response",
              "declarationHash": "sha256:8100d6e15ded6e82db148893f4aecc2f089537579787f7a1454d62f4858a3c83",
              "internal": false
            }
          ]
        }
      ]
    },
    {
      "module": "next",
      "source": {
        "kind": "module"
      },
      "priority": "P0",
      "fixture": "tests/next-surface/fixtures.json#p0-core-types",
      "selectionRationale": "Bind the App Router configuration and metadata contracts without importing the complete Pages Router-oriented root surface.",
      "entrypointDeclaration": {
        "package": "next",
        "path": "index.d.ts"
      },
      "exports": [
        {
          "name": "Metadata",
          "kind": "type",
          "stability": "stable",
          "signatureHash": "sha256:2f0bf8024c0199975df23772a4a4fc4dc58f4d3c6e2ea65b5825336f460a175b",
          "haxeTypePath": "nextjs.raw.metadata.Metadata",
          "exposure": "raw-and-semantic",
          "declarations": [
            {
              "package": "next",
              "path": "dist/lib/metadata/types/metadata-interface.d.ts",
              "syntaxKind": "InterfaceDeclaration",
              "declaredName": "Metadata",
              "declarationHash": "sha256:79a10deb8c5d7f711e579fbb2b85caa02f234dbdd41143daaa5bba84749b732c",
              "internal": true
            }
          ]
        },
        {
          "name": "NextConfig",
          "kind": "type",
          "stability": "stable",
          "signatureHash": "sha256:e7f519c7fdf899381c233d28855ca1a9dc936235dab220f2e6cfe5bd7d6c6e87",
          "haxeTypePath": "nextjs.raw.NextConfig",
          "exposure": "raw-only",
          "declarations": [
            {
              "package": "next",
              "path": "dist/server/config-shared.d.ts",
              "syntaxKind": "InterfaceDeclaration",
              "declaredName": "NextConfig",
              "declarationHash": "sha256:f3f6dfce98f395e1ca89f39ff80fce0e372c385e6a7f64e4f3577193da34c385",
              "internal": true
            }
          ]
        },
        {
          "name": "ResolvingMetadata",
          "kind": "type",
          "stability": "stable",
          "signatureHash": "sha256:10a8438ac22c574d18dfbfeadbcfd31910bb0056fc352ed618138799a58d2fb4",
          "haxeTypePath": "nextjs.raw.metadata.ResolvingMetadata",
          "exposure": "raw-only",
          "declarations": [
            {
              "package": "next",
              "path": "dist/lib/metadata/types/metadata-interface.d.ts",
              "syntaxKind": "TypeAliasDeclaration",
              "declaredName": "ResolvingMetadata",
              "declarationHash": "sha256:08fd91c3826fab44da1fc568e1c2f40567abfa6c5f1ac422332cd3b2b0081164",
              "internal": true
            }
          ]
        },
        {
          "name": "ResolvingViewport",
          "kind": "type",
          "stability": "stable",
          "signatureHash": "sha256:b416f9e552943e66e1af1b4a9ddb8ac1b700a59e53942e99577d177858f07f27",
          "haxeTypePath": "nextjs.raw.metadata.ResolvingViewport",
          "exposure": "raw-only",
          "declarations": [
            {
              "package": "next",
              "path": "dist/lib/metadata/types/metadata-interface.d.ts",
              "syntaxKind": "TypeAliasDeclaration",
              "declaredName": "ResolvingViewport",
              "declarationHash": "sha256:e21d4db2fad578a33a07071e51b3a24f22dcf9166e2eb5f26d47819f26fe3113",
              "internal": true
            }
          ]
        },
        {
          "name": "Viewport",
          "kind": "type",
          "stability": "stable",
          "signatureHash": "sha256:11628a08d0f9ac5de6f4204dfb0b9c3e24f08a2a9172de6a4e2564047980acb1",
          "haxeTypePath": "nextjs.raw.metadata.Viewport",
          "exposure": "raw-and-semantic",
          "declarations": [
            {
              "package": "next",
              "path": "dist/lib/metadata/types/metadata-interface.d.ts",
              "syntaxKind": "InterfaceDeclaration",
              "declaredName": "Viewport",
              "declarationHash": "sha256:f345e83854d519bb4164f36802ce12dad1e5f06337c1ad24fa57032d7b72cc18",
              "internal": true
            }
          ]
        }
      ]
    },
    {
      "module": "next/cache",
      "source": {
        "kind": "module"
      },
      "priority": "P0",
      "fixture": "tests/next-surface/fixtures.json#p0-server",
      "selectionRationale": "Cover the complete documented cache and revalidation entrypoint, with unstable aliases visibly classified instead of silently normalized.",
      "entrypointDeclaration": {
        "package": "next",
        "path": "cache.d.ts"
      },
      "exports": [
        {
          "name": "cacheLife",
          "kind": "function",
          "stability": "stable",
          "signatureHash": "sha256:d6591aabe36985c8842231e7c0357063c85986480864b0ba9552ebd2292416ec",
          "haxeTypePath": "nextjs.raw.Cache",
          "haxeMember": "cacheLife",
          "exposure": "raw-and-semantic",
          "declarations": [
            {
              "package": "next",
              "path": "cache.d.ts",
              "syntaxKind": "FunctionDeclaration",
              "declaredName": "cacheLife",
              "declarationHash": "sha256:97c5250032fc163a282d80f167821f8dd70b2aebeec1310340925fbb4a217180",
              "internal": false
            },
            {
              "package": "next",
              "path": "cache.d.ts",
              "syntaxKind": "FunctionDeclaration",
              "declaredName": "cacheLife",
              "declarationHash": "sha256:a69a185d0dfaca8dec85787f60b6e36de2b0e6c49dc4e26afda219f66b86ce34",
              "internal": false
            },
            {
              "package": "next",
              "path": "cache.d.ts",
              "syntaxKind": "FunctionDeclaration",
              "declaredName": "cacheLife",
              "declarationHash": "sha256:446d3b3b913b10ca73a986d50a91c1091ac71194290c9587cc74d2794e7a11ad",
              "internal": false
            },
            {
              "package": "next",
              "path": "cache.d.ts",
              "syntaxKind": "FunctionDeclaration",
              "declaredName": "cacheLife",
              "declarationHash": "sha256:3e475384a5a5d37341a168069d832577f933b4b6165fcc0ad68636171da629da",
              "internal": false
            },
            {
              "package": "next",
              "path": "cache.d.ts",
              "syntaxKind": "FunctionDeclaration",
              "declaredName": "cacheLife",
              "declarationHash": "sha256:33c2c206bba5446410ecaf847a8c155d7e853b1fa5147e4859ef10804cb3bb9d",
              "internal": false
            },
            {
              "package": "next",
              "path": "cache.d.ts",